ID ECAO	Anatomical Structure	Type (is-a)	Part of	Develops from	Starts at stage	Ends at stage	Description	Synonyms	UBERON type	UBERON (non-exact)	Cell type (is-a)	Cell type (non-exact)	Pubmed id	Comments	XAO Type	Pliv comments	GeneOntology type	URCH specific	hasNoOnto
ID	LABEL	C %	C  'part of' some %	C  'develops from' some %	C  'existence starts during' some %	C  'existence ends during' some %	A obo:IAO_0000115	A oboInOwl:hasExactSynonym	A oboInOwl:hasDbXref										
ECAO:0100350	echinoderm anatomy						Biological entity that is either an individual member of a biological species or constitutes the structural organization of an individual member of a biological species.		UBERON:0001062										
ECAO:0100351	anatomical structure		echinoderm anatomy				Material anatomical entity that has inherent 3D shape and is generated by coordinated expression of the organism's own genome		UBERON:0000061										
ECAO:0100352	anatomical system		echinoderm anatomy				A system that has as its parts distinct anatomical structures interconnected by anatomical structures at a lower level of granularity. Multicellular, connected anatomical structure that has multiple organs as parts and whose parts work together to achieve some shared function	organ system, connected anatomical system, body system	UBERON:0000467										
ECAO:0100353	anatomical region		echinoderm anatomy				A region of the whole organism without well-defined compartmental boundaries	organism subdivision	UBERON:0000475										
ECAO:0100354	anatomical space		echinoderm anatomy						UBERON:0000464										